trait_name,ontology mapable,"needed, not in ontologies",tissue,category,other_tags,nrow,description,Saatkamp_2018,TRY name,TRY number,TRY notes,TOP_trait,Top_identifier,Top_link,Top_link_date,NOTES,proposed_name_changes,workshop (or review),,
accessory_cost_fraction,,,reproductive; seed,allocation,,NA,NA,,Plant biomass and allometry: Reproductive dry mass per plant dry mass (reproductive weight fraction),1046,"similar, not identical",NA,NA,NA,Not in TOP,,accessory_cost_fraction,,biomass > allocation,
accessory_cost_mass,,,reproductive; fruit,allocation,,NA,NA,,NA,NA,NA,NA,NA,NA,Not in TOP,,accessory_cost_mass,,biomass > mass_or_size,
bark_Al_per_dry_mass,,,bark,nutrient,,NA,NA,,NA,NA,NA,bark aluminium content per bark dry mass,TOP373,https://top-thesaurus.org/annotationInfo?viz=1&&trait=Bark_aluminium_content_per_bark_dry_mass,20210518,,nutrient_bark_Al_content_per_dry_mass,,chemical >element/nutrient,
bark_ash_content_per_dry_mass,,,bark,nutrient,fire_response,NA,NA,,NA,NA,NA,NA,NA,NA,Not in TOP,,chemical_bark_ash_content_per_dry_mass,,chemical > compound,
bark_B_per_dry_mass,,,bark,nutrient,,NA,NA,,NA,NA,NA,bark boron content per bark dry mass,TOP374,https://top-thesaurus.org/annotationInfo?viz=1&&trait=Bark_boron_content_per_bark_dry_mass,20210518,,nutrient_bark_B_content_per_dry_mass,,chemical >element/nutrient,
bark_C_per_dry_mass,,,bark,nutrient,,NA,NA,,Bark carbon (C) content per bark dry mass,617,NA,bark calcium content per bark dry mass,TOP375,https://top-thesaurus.org/annotationInfo?viz=1&&trait=Bark_calcium_content_per_bark_dry_mass,20210518,,nutrient_bark_C_content_per_dry_mass,,chemical >element/nutrient,
bark_Ca_per_dry_mass,,,bark,nutrient,,NA,NA,,Bark calcium (Ca) content per bark dry mass,2957,NA,bark carbon content per bark dry mass,TOP376,https://top-thesaurus.org/annotationInfo?viz=1&&trait=Bark_carbon_content_per_bark_dry_mass,20210518,,nutrient_bark_Ca_content_per_dry_mass,,chemical >element/nutrient,
bark_cellulose_per_dry_mass,,,bark,nutrient,,NA,NA,,NA,NA,NA,bark cellulose content per bark dry mass,TOP813,https://top-thesaurus.org/annotationInfo?viz=1&&trait=Bark_cellulose_content_per_bark_dry_mass,20210518,,chemical_bark_cellulose_content_per_dry_mass,,chemical > compound,
bark_Cu_per_dry_mass,,,bark,nutrient,,NA,NA,,Bark copper (Cu) content per bark dry mass,2958,NA,bark copper content per bark dry mass,TOP379,https://top-thesaurus.org/annotationInfo?viz=1&&trait=Bark_copper_content_per_bark_dry_mass,20210518,,nutrient_bark_Cu_content_per_dry_mass,,chemical >element/nutrient,
bark_delta13C,,,bark,physiology,isotope,NA,NA,,Bark carbon (C) isotope signature (delta 13C),829,NA,NA,NA,NA,Not in TOP,,isotope_delta13C_bark,,physiology > stable_isotope_signature,
bark_delta15N,,,bark,physiology,isotope,NA,NA,,Bark nitrogen (N) isotope signature (delta 15N),832,NA,NA,NA,NA,Not in TOP,,isotope_delta15N_bark,,physiology > stable_isotope_signature,
bark_density,,,bark,allocation,,NA,NA,,Bark density (bark dry mass per bark volume),248,NA,stem bark dry mass per stem bark fresh volume,TOP282,https://top-thesaurus.org/annotationInfo?viz=1&&trait=Bark_density,20210518,,bark_density,,biomass > allocation,
bark_Fe_per_dry_mass,,,bark,nutrient,,NA,NA,,Bark iron (Fe) content per bark dry mass,2959,NA,bark iron content per bark dry mass,TOP380,https://top-thesaurus.org/annotationInfo?viz=1&&trait=Bark_iron_content_per_bark_dry_mass,20210518,,nutrient_bark_Fe_content_per_dry_mass,,chemical >element/nutrient,
bark_K_per_dry_mass,,,bark,nutrient,,NA,NA,,Bark potassium (K) content per bark dry mass,2960,NA,bark potassium content per bark dry mass,TOP388,https://top-thesaurus.org/annotationInfo?viz=1&&trait=Bark_potassium_content_per_bark_dry_mass,20210518,,nutrient_bark_K_content_per_dry_mass,,chemical >element/nutrient,
bark_lignin_per_dry_mass,,,bark,nutrient,,NA,NA,,NA,NA,NA,bark lignin content per bark dry mass,TOP838,https://top-thesaurus.org/annotationInfo?viz=1&&trait=Bark_lignin_content_per_bark_dry_mass,20210518,,chemical_bark_lignin_content_per_dry_mass,,chemical > compound,
bark_mass_area,,,bark,allocation,,1,Bark mass per unit surface area of stem,,NA,NA,NA,NA,NA,NA,Not in TOP,,bark_dry_mass_per_surface_area,,biomass > allocation,
bark_Mg_per_dry_mass,,,bark,nutrient,,NA,NA,,Bark magnesium (Mg) content per bark dry mass,2961,NA,bark magnesium content per bark dry mass,TOP381,https://top-thesaurus.org/annotationInfo?viz=1&&trait=Bark_magnesium_content_per_bark_dry_mass,20210518,,nutrient_bark_Mg_content_per_dry_mass,,chemical >element/nutrient,
bark_Mn_per_dry_mass,,,bark,nutrient,,NA,NA,,Bark manganese (Mn) content per bark dry mass,2962,NA,bark manganese content per bark dry mass,TOP382,https://top-thesaurus.org/annotationInfo?viz=1&&trait=Bark_manganese_content_per_bark_dry_mass,20210518,,nutrient_bark_Mn_content_per_dry_mass,,chemical >element/nutrient,
bark_morphology,,,bark,morphology,,NA,NA,,Description of bark morphology,NA,NA,NA,,NA,Not in TOP,,bark_morphology,(review),morphology > bark,needs to be heirarchical with more values
bark_N_per_dry_mass,,,bark,nutrient,,NA,NA,,Bark nitrogen (N) content per bark dry mass,618,NA,bark nitrogen content per bark dry mass,TOP386,https://top-thesaurus.org/annotationInfo?viz=1&&trait=Bark_nitrogen_content_per_bark_dry_mass,20210518,,nutrient_bark_N_content_per_dry_mass,,chemical >element/nutrient,
bark_Na_per_dry_mass,,,bark,nutrient,,NA,NA,,NA,NA,NA,bark sodium content per bark dry mass,TOP384,https://top-thesaurus.org/annotationInfo?viz=1&&trait=Bark_sodium_content_per_bark_dry_mass,20210518,,nutrient_bark_Na_content_per_dry_mass,,chemical >element/nutrient,
bark_P_per_dry_mass,,,bark,nutrient,,NA,NA,,Bark phosphorus (P) content per bark dry mass,619,NA,bark phosphorus content per bark dry mass,TOP387,https://top-thesaurus.org/annotationInfo?viz=1&&trait=Bark_phosphorus_content_per_bark_dry_mass,20210518,,nutrient_bark_P_content_per_dry_mass,,chemical >element/nutrient,
bark_S_per_dry_mass,,,bark,nutrient,,NA,NA,,Bark sulfur (S) content per bark dry mass,2963,NA,bark sulfur content per bark dry mass,TOP390,https://top-thesaurus.org/annotationInfo?viz=1&&trait=Bark_sulfur_content_per_bark_dry_mass,20210518,,nutrient_bark_S_content_per_dry_mass,,chemical >element/nutrient,
bark_tannin_per_dry_mass,,,bark,nutrient,chemical_defence,NA,NA,,NA,NA,NA,NA,NA,NA,Not in TOP,,chemical_bark_tannin_content_per_dry_mass,,chemical > compound,
bark_thickness,,,bark,morphology,,2,Thickness of the bark of the stem,,Bark thickness,"24, 3355, 3356",NA,stem bark thickness,TOP283,https://top-thesaurus.org/annotationInfo?viz=1&&trait=Bark_thickness,20210518,,bark_thickness,,biomass > mass_or_size,
bark_water_content_per_dry_mass,,,bark,allocation,plant_hydraulics,NA,NA,,NA,NA,NA,NA,NA,NA,Not in TOP,,bark_water_content_per_dry_mass,,biomass > allocation,
bark_water_content_per_saturated_mass,,,bark,allocation,plant_hydraulics,NA,NA,,NA,NA,NA,NA,NA,NA,Not in TOP,,bark_water_content_per_saturated_mass,,biomass > allocation,
bark_Zn_per_dry_mass,,,bark,nutrient,,NA,NA,,"	Bark zinc (Zn) content per bark dry mass",2964,NA,bark zinc content per bark dry mass,TOP391,https://top-thesaurus.org/annotationInfo?viz=1&&trait=Bark_zinc%20content%20per%20bark%20dry%20mass,20210518,,nutrient_bark_Zn_content_per_dry_mass,,chemical >element/nutrient,
basal_diameter,,,stem,morphology,,199,"Diameter at the base of the plant, standardly ""DBH"" except in short plants",,Stem diameter,21,NA,NA,NA,NA,Not in TOP,,basal_diameter_maximum,,biomass > allocation,
branch_mass_fraction,,,stem,allocation,,3,Fraction of plant dry mass comprised of branch material,,Plant biomass and allometry: branch dry mass per plant dry mass,137,NA,NA,NA,NA,Not in TOP,,,,biomass > allocation,
bulk_modulus_of_elasticity,,,stem,physiology,plant_hydraulics,NA,NA,,Leaf elastic modulus,190,NA,NA,NA,NA,Not in TOP,,,(water transport review),physiology > water_transport,
ca,,,leaf,physiology,gas_exchange; photosynthetic,NA,NA,,NA,NA,NA,NA,NA,NA,Not in TOP,,leaf_external_carbon_dioxide_concentration,(gas exchange/fluor minor review),physiology > gas_exchange > carbon_dioxide_concentration,
calcicole_status,,,whole_plant,life history,environmental_tolerance,NA,NA,,"Dichotonmous variable, defining plants as calcifuge (intolerant of basic soils) versus calcicole (tolerant of basic soils, such as calcareous sands and limestone derived soils)",NA,NA,plant populations reaction indicator value according to Ellenberg,TOP781,https://top-thesaurus.org/annotationInfo?viz=1&&trait=Ellenberg_reaction_value,20210519,not an exact match,,(environmental tolerance),life_history > environmental_tolerance,
carotenoid_per_area,,,leaf,nutrient,chemical_defence,NA,NA,,Leaf carotenoid content per leaf area,491,NA,NA,NA,NA,Not in TOP,,chemical_leaf_carotenoid_content_per_area,,chemical > compound,
carotenoid_per_dry_mass,,,leaf,nutrient,chemical_defence,NA,NA,,Leaf carotenoid content per leaf dry mass,809,NA,NA,NA,NA,Not in TOP,,chemical_leaf_carotenoid_content_per_dry_mass,,chemical > compound,
cc,,,leaf,physiology,gas_exchange; photosynthetic,NA,NA,,Leaf photosynthesis CO2 concentration at chloroplast,3007,NA,NA,NA,NA,Not in TOP,,leaf_chloroplast_internal_carbon_dioxide_concentration,(gas exchange/fluor minor review),physiology > gas_exchange > carbon_dioxide_concentration,
cell_cross-sectional_area,,,leaf,morphology,cellular_scale,NA,NA,,Leaf epidermis cell area; Leaf mesophyll cell area,338; 573,NA,NA,NA,NA,Not in TOP,,cell_morphology_leaf_cell_cross-sectional_area,,morphology > cellular,
cell_epidermis_Ca_per_fresh_mass,,,leaf,nutrient,cellular_scale,5,Ca content of epidermal cells,,NA,NA,NA,NA,NA,NA,Not in TOP,,nutrient_cell_epidermis_Ca_content_per_fresh_mass,,chemical >element/nutrient,
cell_epidermis_P_per_fresh_mass,,,leaf,nutrient,cellular_scale,11,P content of epidermal cells,,NA,NA,NA,NA,NA,NA,Not in TOP,,nutrient_cell_epidermis_P_content_per_fresh_mass,,chemical >element/nutrient,
cell_hypodermis_Ca_per_fresh_mass,,,leaf,nutrient,cellular_scale,6,Ca content of hypodermis cells,,NA,NA,NA,NA,NA,NA,Not in TOP,,nutrient_cell_hypodermis_Ca_content_per_fresh_mass,,chemical >element/nutrient,
cell_hypodermis_P_per_fresh_mass,,,leaf,nutrient,cellular_scale,12,P content of hypodermis cells,,NA,NA,NA,NA,NA,NA,Not in TOP,,nutrient_cell_hypodermis_P_content_per_fresh_mass,,chemical >element/nutrient,
cell_internal_parenchyma_Ca_per_fresh_mass,,,leaf,nutrient,cellular_scale,7,Ca content of internal parenchyma cells,,NA,NA,NA,NA,NA,NA,Not in TOP,,nutrient_cell_internal_parenchyma_Ca_content_per_fresh_mass,,chemical >element/nutrient,
cell_internal_parenchyma_P_per_fresh_mass,,,leaf,nutrient,cellular_scale,13,P content of internal parenchyma cells,,NA,NA,NA,NA,NA,NA,Not in TOP,,nutrient_cell_internal_parenchyma_P_content_per_fresh_mass,,chemical >element/nutrient,
cell_palisade_mesophyll_Ca_per_fresh_mass,,,leaf,nutrient,cellular_scale,8,Ca content of palisade mesophyll cells,,NA,NA,NA,NA,NA,NA,Not in TOP,,nutrient_cell_palisade_mesophyll_Ca_content_per_fresh_mass,,chemical >element/nutrient,
cell_palisade_mesophyll_P_per_fresh_mass,,,leaf,nutrient,cellular_scale,14,P content of palisade mesophyll cells,,NA,NA,NA,NA,NA,NA,Not in TOP,,nutrient_cell_palisade_mesophyll_P_content_per_fresh_mass,,chemical >element/nutrient,
cell_rubisco_concentration,,,leaf,nutrient,molecular; photosynthetic,NA,NA,,Leaf Rubisco content per leaf area,504,"similar, not identical",NA,NA,NA,Not in TOP,,chemical_cell_rubisco_content_per_??_mass,,chemical > compound,need to verify if dry vs fresh mass
cell_rubisco_N_per_total_N,,,leaf,nutrient,molecular; photosynthetic,NA,NA,,Leaf nitrogen (N) fraction in Rubisco,187,NA,NA,NA,NA,Not in TOP,,chemical_cell_rubisco_N_content_per_total_N,,chemical > compound,"need to verify if ""total"" just leaves or whole plant"
cell_sclerenchyma_Ca_per_fresh_mass,,,leaf,nutrient,cellular_scale,9,Ca content of sclerenchyma cells,,NA,NA,NA,NA,NA,NA,Not in TOP,,nutrient_cell_sclerenchyma_Ca_content_per_fresh_mass,,chemical >element/nutrient,
cell_sclerenchyma_P_per_fresh_mass,,,leaf,nutrient,cellular_scale,15,P content of sclerenchyma cells,,NA,NA,NA,NA,NA,NA,Not in TOP,,nutrient_cell_sclerenchyma_P_content_per_fresh_mass,,chemical >element/nutrient,
cell_spongy_mesophyll_Ca_per_fresh_mass,,,leaf,nutrient,cellular_scale,10,Ca content of spongy mesophyll cells,,NA,NA,NA,NA,NA,NA,Not in TOP,,nutrient_cell_spongy_mesophyll_Ca_content_per_fresh_mass,,chemical >element/nutrient,
cell_spongy_mesophyll_P_per_fresh_mass,,,leaf,nutrient,cellular_scale,16,P content of spongy mesophyll cells,,NA,NA,NA,NA,NA,NA,Not in TOP,,nutrient_cell_spongy_mesophyll_P_content_per_fresh_mass,,chemical >element/nutrient,
cell_thylakoid_N_per_total_N,,,leaf,nutrient,cellular_scale,NA,NA,,NA,NA,NA,NA,NA,NA,Not in TOP,,nutrient_cell_thylakoid_N_content_per_total_N,,chemical >element/nutrient,"need to verify if ""total"" just leaves or whole plant"
chlorophyll_A_B_ratio,,,leaf,nutrient,molecular; photosynthetic,18,Ratio of chlorophyll A to chlorophyll B,,Leaf chlorophyll a/b ratio,416,NA,NA,NA,NA,Not in TOP,,chemical_leaf_chlorophyll_A_B_ratio,,chemical > compound,
chlorophyll_A_per_area,,,leaf,nutrient,molecular; photosynthetic,NA,NA,,Leaf chlorophyll content per leaf area (Chl a),3476,NA,NA,NA,NA,Not in TOP,,chemical_leaf_chlorophyll_A_content_per_area,,chemical > compound,
chlorophyll_A_per_dry_mass,,,leaf,nutrient,molecular; photosynthetic,NA,NA,,Leaf chlorophyll content per leaf dry mass (Chl a),3474,NA,NA,NA,NA,Not in TOP,,chemical_leaf_chlorophyll_A_content_per_dry_mass,,chemical > compound,
chlorophyll_B_per_area,,,leaf,nutrient,molecular; photosynthetic,NA,NA,,Leaf chlorophyll content per leaf area (Chl b),3477,NA,NA,NA,NA,Not in TOP,,chemical_leaf_chlorophyll_B_content_per_area,,chemical > compound,
chlorophyll_B_per_dry_mass,,,leaf,nutrient,molecular; photosynthetic,NA,NA,,Leaf chlorophyll content per leaf dry mass (Chl b),3475,NA,NA,NA,NA,Not in TOP,,chemical_leaf_chlorophyll_B_content_per_dry_mass,,chemical > compound,
chlorophyll_per_area,,,leaf,nutrient,molecular; photosynthetic,NA,NA,,Leaf chlorophyll content per leaf area,413,NA,NA,NA,NA,Not in TOP,,chemical_leaf_chlorophyll_content_per_area,,chemical > compound,
chlorophyll_per_dry_mass,,,leaf,nutrient,molecular; photosynthetic,NA,NA,,Leaf chlorophyll content per leaf dry mass,164,NA,NA,NA,NA,Not in TOP,,chemical_leaf_chlorophyll_content_per_dry_mass,,chemical > compound,
ci_at_Amax,,,leaf,physiology,gas_exchange; photosynthetic,20,internal CO2 concentration during Amax measurement,,Leaf photosynthetic A/Ci curve: intercellular CO2 concentration,3366,"similar, not identical",NA,NA,NA,Not in TOP,,leaf_internal_carbon_dioxide_concentration_maximum,(gas exchange/fluor minor review),physiology > gas_exchange > carbon_dioxide_concentration,
ci_at_ambient,,,leaf,physiology,gas_exchange; photosynthetic,19,internal CO2 concentration under ambient conditions,,Leaf photosynthetic A/Ci curve: intercellular CO2 concentration,3366,"similar, not identical",NA,NA,NA,Not in TOP,,leaf_internal_carbon_dioxide_concentration_ambient,(gas exchange/fluor minor review),physiology > gas_exchange > carbon_dioxide_concentration,
ci_at_Asat,,,leaf,physiology,gas_exchange; photosynthetic,21,internal CO2 concentration during Asat measurement,,Leaf photosynthetic A/Ci curve: intercellular CO2 concentration,3366,NA,NA,NA,NA,Not in TOP,,leaf_internal_carbon_dioxide_concentration_saturated,(gas exchange/fluor minor review),physiology > gas_exchange > carbon_dioxide_concentration,
ci_over_ca,,,leaf,physiology,gas_exchange; photosynthetic,22,Ratio of internal to external CO2 concentrations,,Leaf photosynthesis: intercellular CO2 concentration to ambient CO2 (ci/ca),3379,NA,NA,NA,NA,Not in TOP,,leaf_internal_external_carbon_dioxide_concentration_ratio,(gas exchange/fluor minor review),physiology > gas_exchange > carbon_dioxide_concentration,
competitive_stratum,,,whole_plant,life history,,NA,NA,,NA,NA,NA,NA,NA,NA,Not in TOP,,,(environmental tolerance),life_history > environmental_tolerance,
cotyledon_function,,,leaf,life history,,NA,NA,,NA,NA,NA,NA,NA,NA,Not in TOP,,seedling_cotyledon_function,,life_history > reproductive,
cotyledon_position,,,leaf,morphology,,NA,NA,,NA,NA,NA,NA,NA,NA,Not in TOP,,seedling_cotyledon_position,,morphology > seedling,
cotyledon_type,,,leaf,morphology,,NA,NA,,NA,NA,NA,NA,NA,NA,Not in TOP,,seedling_cotyledon_type,,morphology > seedling,
dead_wood_Ca_per_dry_mass,,,stem,nutrient,,NA,NA,,"Litter (other than leaf: twigs, bark, flowers...) calcium (Ca) content per litter dry mass",2892,NA,coarse woody debris calcium content per coarse woody debris dry mass,TOP750,https://top-thesaurus.org/annotationInfo?viz=1&&trait=Coarse_woody_debris_calcium_content_per_coarse_woody_debris_dry_mass_trait,20210518,,nutrient_litter_wood_Ca_content_per_dry_mass,,chemical >element/nutrient,
dead_wood_K_per_dry_mass,,,stem,nutrient,,NA,NA,,"Litter (other than leaf: twigs, bark, flowers...) potassium (K) content per litter dry mass",2891,NA,coarse woody debris potassium content per coarse woody debris dry mass,TOP763,https://top-thesaurus.org/annotationInfo?viz=1&&trait=Coarse_woody_debris_potassium_content_per_coarse_woody_debris_dry_mass_trait,20210518,,nutrient_litter_wood_K_content_per_dry_mass,,chemical >element/nutrient,
dead_wood_Mg_per_dry_mass,,,stem,nutrient,,NA,NA,,"Litter (other than leaf: twigs, bark, flowers...) magnesium (Mg) content per litter dry mass",2893,NA,coarse woody debris magnesium content per coarse woody debris dry mass,TOP756,https://top-thesaurus.org/annotationInfo?viz=1&&trait=Coarse_woody_debris_magnesium_content_per_coarse_woody_debris_dry_mass_trait,20210518,,nutrient_litter_wood_Mg_content_per_dry_mass,,chemical >element/nutrient,
dead_wood_N_per_dry_mass,,,stem,nutrient,,NA,NA,,Litter twig nitrogen (N) content per twig dry mass,1199,NA,coarse woody debris nitrogen content per coarse woody debris dry mass,TOP761,https://top-thesaurus.org/annotationInfo?viz=1&&trait=Coarse_woody_debris_nitrogen_content_per_coarse_woody_debris_dry_mass_trait,20210518,,nutrient_litter_wood_N_content_per_dry_mass,,chemical >element/nutrient,
dead_wood_Na_per_dry_mass,,,stem,nutrient,,NA,NA,,"Litter (other than leaf: twigs, bark, flowers...) sodium (Na) content per litter dry mass",2898,NA,coarse woody debris sodium content per coarse woody debris dry mass,TOP759,https://top-thesaurus.org/annotationInfo?viz=1&&trait=Coarse_woody_debris_sodium_content_per_coarse_woody_debris_dry_mass_trait,20210518,,nutrient_litter_wood_Na_content_per_dry_mass,,chemical >element/nutrient,
dead_wood_P_per_dry_mass,,,stem,nutrient,,NA,NA,,Litter other than leaf phosphorus (P) content per litter dry mass,2890,NA,coarse woody debris phosphorus content per coarse woody debris dry mass,TOP762,https://top-thesaurus.org/annotationInfo?viz=1&&trait=Coarse_woody_debris_phosphorus_content_per_coarse_woody_debris_dry_mass_trait,20210518,,nutrient_litter_wood_P_content_per_dry_mass,,chemical >element/nutrient,
diaspore_mass,,,reproductive; seed,morphology,,23,Mass of seed including dispersal appendages,,Dispersal unit dry mass,233,NA,dispersule dry mass,TOP110,https://top-thesaurus.org/annotationInfo?viz=1&trait=Dispersule%20dry%20mass%20trait,20210518,"TOP110 includes fruit, seed, germinule - a menu in heirarchy, not an end point; does link to appropriate TRY name",,seed and fruit traits,morphology > reproductive > seed / allocation,
dispersal_appendage,,,reproductive; seed,morphology,,24,Type of dispersal appendage present,dispersal potential,Dispersal unit type,231,NA,NA,NA,NA,Not in TOP,,,seed and fruit traits,morphology > reproductive > seed,
dispersal_syndrome,,,reproductive; seed,life history,dispersal,25,"Type of dispersal syndrome displayed by species, although the list includes many dispersal appendages and fruit types. Many definitions come from Kew Botanic Gardens website.",dispersal potential,Dispersal syndrome,28,NA,whole plant dispersal syndrome,TOP346,http://top-thesaurus.org/annotationInfo?viz=1&trait=Plant%20dispersal%20syndrome,2020,,,seed and fruit traits,life_history > reproductive > seed,
dispersers,,,reproductive; seed,life history,dispersal,NA,NA,dispersal vector; dispersal potential,Dispersal syndrome,28,"similar, not identical",NA,NA,NA,Not in TOP,,,seed and fruit traits,life_history > reproductive > seed,merge into dispersal_syndrome?
dormancy_type,,,whole_plant,life history,fire_response,26,Classification for seed dormancy,,NA,NA,NA,NA,NA,NA,Not in TOP,,,fire response,life_history > fire_response,
embryo_colour,,,reproductive; seed,morphology,,NA,NA,,NA,NA,NA,NA,NA,NA,Not in TOP,,seedling_embryo_colour,,morphology > seedling,
epidermal_cell_density_abaxial,,,leaf,morphology,cellular_scale,NA,NA,,NA,NA,NA,NA,NA,NA,Not in TOP,,cell_morphology_leaf_epidermal_cell_density_abaxial,,morphology > cellular,??use abaxial/adaxial or upper_surface/lower_surface
epidermal_cell_density_adaxial,,,leaf,morphology,cellular_scale,NA,NA,,NA,NA,NA,NA,NA,NA,Not in TOP,,cell_morphology_leaf_epidermal_cell_density_adaxial,,morphology > cellular,??use abaxial/adaxial or upper_surface/lower_surface
epidermal_cell_density_both_sides,,,leaf,morphology,cellular_scale,NA,NA,,NA,NA,NA,NA,NA,NA,Not in TOP,,cell_morphology_leaf_epidermal_cell_density,,morphology > cellular,??use abaxial/adaxial or upper_surface/lower_surface
epidermis_thickness,,,leaf,morphology,cellular_scale,NA,NA,,Leaf epidermis thickness,101,NA,NA,NA,NA,Not in TOP,,cell_morphology_leaf_epidermis_thickness,,morphology > cellular,??use abaxial/adaxial or upper_surface/lower_surface
epidermis_thickness_lower_leaf_surface,,,leaf,morphology,cellular_scale,NA,NA,,Leaf epidermis thickness,101,NA,NA,NA,NA,Not in TOP,,cell_morphology_leaf_epidermis_thickness_abaxial,,morphology > cellular,??use abaxial/adaxial or upper_surface/lower_surface
epidermis_thickness_upper_leaf_surface,,,leaf,morphology,cellular_scale,NA,NA,,Leaf epidermis thickness,101,NA,NA,NA,NA,Not in TOP,,cell_morphology_leaf_epidermis_thickness_adaxial,,morphology > cellular,??use abaxial/adaxial or upper_surface/lower_surface
establishment_light_environment_index,,,whole_plant,life history,light_interaction,NA,NA,light requirement,NA,NA,NA,NA,NA,NA,Not in TOP,,,seed and fruit traits; (environmental tolerance),life_history > environmental_tolerance,
fire_and_establishing,,,reproductive,life history,fire_response,NA,NA,light requirement,XXXX,NA,NA,NA,NA,NA,Not in TOP,,,seed and fruit traits; fire response,life_history > fire_response,
fire_cued_seeding,,,reproductive; seed,life history,fire_response,31,Distinguishes between plants that do and do not have fire-cued seeding,dormancy-breaking cues,NA,NA,NA,NA,NA,NA,Not in TOP,,,seed and fruit traits; fire response,life_history > fire_response,
fire_flame_duration,,,whole_plant,life history,fire_response,NA,NA,,NA,NA,NA,NA,NA,NA,Not in TOP,,,fire response,life_history > fire_response,
fire_fuel_bed_bulk_density,,,whole_plant,life history,fire_response,NA,NA,,NA,NA,NA,NA,NA,NA,Not in TOP,,,fire response,life_history > fire_response,
fire_fuel_comsumption,,,whole_plant,life history,fire_response,NA,NA,,NA,NA,NA,NA,NA,NA,Not in TOP,,,fire response,life_history > fire_response,
fire_rate_of_spread,,,whole_plant,life history,fire_response,NA,NA,,NA,NA,NA,NA,NA,NA,Not in TOP,,,fire response,life_history > fire_response,
fire_response,,,whole_plant,life history,fire_response,29,Distinguishes between plants that are killed by fire and resprout following fire,,Species tolerance to fire; Plant resprouting capacity,318; 819,NA,NA,NA,NA,Not in TOP,,,fire response,life_history > fire_response,
fire_response_detailed,,,whole_plant,life history,fire_response,30,Detailed information distinguishing between plants that are killed by fire and resprout following fire,,Species tolerance to fire; Plant resprouting capacity,318; 819,NA,NA,NA,NA,Not in TOP,,,fire response,life_history > fire_response,
fire_response_juvenile,,,whole_plant,life history,fire_response,NA,NA,,Variable summarising how juvenile plants respond to fire,NA,NA,NA,NA,NA,Not in TOP,,,fire response,life_history > fire_response,
fire_response_on_maturity,,,whole_plant,life history,fire_response,NA,NA,,Variable summarising how plants' maturity status changes following fire,NA,NA,NA,NA,NA,Not in TOP,,,fire response,life_history > fire_response,
fire_smoulder_duration,,,whole_plant,life history,fire_response,NA,NA,,NA,NA,NA,NA,NA,NA,Not in TOP,,,fire response,life_history > fire_response,
fire_time_to_ignition,,,whole_plant,life history,fire_response,NA,NA,,NA,NA,NA,NA,NA,NA,Not in TOP,,,fire response,life_history > fire_response,
fire_total_burn_duration,,,whole_plant,life history,fire_response,NA,NA,,NA,NA,NA,NA,NA,NA,Not in TOP,,,fire response,life_history > fire_response,
flood_regime_classification,,,whole_plant,life history,environmental_tolerance,NA,NA,,NA,NA,NA,plant populations moisture indicator value according to Ellenberg,TOP779,https://top-thesaurus.org/annotationInfo?viz=1&&trait=Ellenberg_moisture_value,20210519,not an exact match,,(environmental tolerance),life_history > environmental_tolerance,
flower_androecium_structural_merism,,,reproductive; flower,morphology,,NA,NA,,NA,NA,NA,NA,NA,NA,Not in TOP,,,MTS,morphology > reproductive > flower,
flower_androecium_structural_phyllotaxis,,,reproductive; flower,morphology,,NA,NA,,NA,NA,NA,NA,NA,NA,Not in TOP,,,MTS,morphology > reproductive > flower,
flower_androecium_structural_whorls_count,,,reproductive; flower,morphology,,NA,NA,,NA,NA,NA,NA,NA,NA,Not in TOP,,,MTS,morphology > reproductive > flower,
flower_anther_attachment,,,reproductive; flower,morphology,,NA,NA,,NA,NA,NA,NA,NA,NA,Not in TOP,,,MTS,morphology > reproductive > flower,
flower_anther_connective_extension,,,reproductive; flower,morphology,,NA,NA,,NA,NA,NA,NA,NA,NA,Not in TOP,,,MTS,morphology > reproductive > flower,
